{
  "schemaVersion": "1.0.0",
  "status": "fictional-demo-proposals-not-measured-engineering-data",
  "currency": "Workshop research credits (fictional)",
  "demonstrations": [
    {
      "id": "plate-impact",
      "title": "Sternum Plate — Single Impact",
      "partId": "torso.sternum-plate",
      "cost": 120,
      "setupMinutes": 18,
      "description": "Isolate the current high-hit candidate plate, mount it in the instrumented test frame, and fire one controlled prototype round.",
      "sequence": [
        "instrument",
        "mount",
        "arm",
        "fire"
      ],
      "effects": {
        "impact": true,
        "penetration": true,
        "barrelHeat": true,
        "armorHeat": true,
        "heatDistortion": true,
        "scientistDialogue": true
      },
      "researchQuestion": "How should the plate trade impact resistance, mass, and heat transfer?"
    },
    {
      "id": "cooling-iteration",
      "title": "Thermal Dissipation — Prototype B",
      "partId": "pack.heat-exchangers.left",
      "cost": 450,
      "setupMinutes": 42,
      "description": "Route a larger share of the weapon's waste heat into the exoskeleton heat-exchange path and compare cooldown behavior.",
      "sequence": [
        "instrument",
        "route-heat",
        "fire",
        "compare"
      ],
      "effects": {
        "impact": false,
        "penetration": false,
        "barrelHeat": true,
        "armorHeat": true,
        "heatDistortion": true,
        "scientistDialogue": true
      },
      "researchQuestion": "Can the chassis accept and spread the thermal load without creating a new hot spot?"
    },
    {
      "id": "baseline-cutaway",
      "title": "Plate Construction — Cutaway",
      "partId": "torso.sternum-plate",
      "cost": 65,
      "setupMinutes": 9,
      "description": "Inspect the plate's current blockout layers and unknowns without firing a weapon.",
      "sequence": [
        "isolate",
        "cutaway",
        "inspect"
      ],
      "effects": {
        "impact": false,
        "penetration": false,
        "barrelHeat": false,
        "armorHeat": false,
        "heatDistortion": false,
        "scientistDialogue": false
      },
      "researchQuestion": "Which layer stack, interfaces, and acceptance criteria should be researched first?"
    }
  ],
  "simulationDisclaimer": "Costs, setup estimates, hit frequency, impact response, temperatures, and cooling improvements are fictional gameplay parameters. They are not empirical test results or certified engineering specifications.",
  "simulationAssumptions": {
    "mostFrequentlyHitArmorPartId": "torso.sternum-plate",
    "hitFrequencyBasis": "fictional-combat-telemetry",
    "hitFrequencyStatus": "gameplay-premise-not-measured",
    "hitShare": null,
    "note": "The sternum plate is the current most-hit candidate for demonstration selection. No empirical hit percentage is asserted; a later campaign simulation can produce and version the distribution."
  }
}
